{
  "standardVersion": 1.0,
  "documentName": "A Valid BoM",
  "documentCreator": "A Valid Creator",
  "documentCreatedDate": "2020-07-30T06:31:58+0000",
  "assetType": "HardwareComponent",
  "assetSubType": "AValidSubType",
  "assetManufacturer": "A Valid Manufacturer",
  "assetModelNumber": "A Valid ModelNumber",
  "assetDescription": "A Valid Description",
  "assetMetadata": {
    "manufactureFingerprint": "<valid-fingerprint>"
  },
  "manufactureSignature": ""
}
